{
  "schema_version": "1.1",
  "tool_version": "0.4.0",
  "timestamp_utc": "2026-04-27T12:00:00.000Z",
  "target": "github.com",
  "country": "RU",
  "region": "Moscow",
  "network": {
    "asn": 12389,
    "provider": "Rostelecom",
    "connection_type": "home"
  },
  "results": {
    "dns": {
      "status": "ok",
      "latency_ms": 14,
      "addresses_count": 2
    },
    "tcp_443": {
      "status": "ok",
      "latency_ms": 80,
      "port": 443
    },
    "tls": {
      "status": "ok",
      "latency_ms": 120,
      "protocol": "TLSv1.3"
    },
    "http": {
      "status": "ok",
      "latency_ms": 180,
      "status_code": 200,
      "body_sha256": "13ba91c058d5b137c136f57a0ac5990dd94bcb5d38f699e7b39522b8133c1e5c",
      "headers_hash": "3a47e9d79d0e798a5dc6d2c9d2965e9db87b7a5e0006ec32ac799cb094a9646c"
    }
  },
  "diagnosis": {
    "category": "ok",
    "confidence": 0.94,
    "signals": [
      "dns, tcp, tls, and http checks passed"
    ]
  }
}
